{
  "schemaVersion": "1.0.0",
  "catalogVersion": "2026.10.01.2",
  "generatedAt": "2026-09-29T00:00:00+09:00",
  "items": [
    {
      "fileName": "payment_instruments.json",
      "schemaId": "urn:bestpay:schema:payment-instrument:1.0.0",
      "contentHash": "5ec47bde96569a37c8452d14b37d15a820fab2eff74da604f8028e8b1caeb852",
      "required": true
    },
    {
      "fileName": "payment_routes.json",
      "schemaId": "urn:bestpay:schema:payment-route:1.0.0",
      "contentHash": "9e7960699e7f373cb7ff6837deff974fb5022424d9ce229e456f9b9231a25fcc",
      "required": true
    },
    {
      "fileName": "payment_modes.json",
      "schemaId": "urn:bestpay:schema:payment-mode:1.0.0",
      "contentHash": "51f3389142014edd73898e0e5e00c06288755a92d1892f47301026e945637b18",
      "required": true
    },
    {
      "fileName": "funding_relations.json",
      "schemaId": "urn:bestpay:schema:funding-relation:1.0.0",
      "contentHash": "51f3389142014edd73898e0e5e00c06288755a92d1892f47301026e945637b18",
      "required": true
    },
    {
      "fileName": "merchant_groups.json",
      "schemaId": "urn:bestpay:schema:merchant-group:1.0.0",
      "contentHash": "65e7ec5d8485e36f4d8afbc5222c25373c137a7cb02ca08e64a3ad15f92e103e",
      "required": true
    },
    {
      "fileName": "merchants.json",
      "schemaId": "urn:bestpay:schema:merchant:1.0.0",
      "contentHash": "99e184ba639c714e3a1edb96e2adecc1a70de99eafe611769fba23e4b4f2126f",
      "required": true
    },
    {
      "fileName": "merchant_categories.json",
      "schemaId": "urn:bestpay:schema:merchant-category:1.0.0",
      "contentHash": "6411949dbfeeb0938d357151eda9e8dffb420f68fa48d196cc9cfa3a1db141d9",
      "required": true
    },
    {
      "fileName": "point_programs.json",
      "schemaId": "urn:bestpay:schema:point-program:1.0.0",
      "contentHash": "a2e5e369e7ba2694aed7f77f6cb8758b024f59e4802fff16bee59a133a37647e",
      "required": true
    },
    {
      "fileName": "condition_definitions.json",
      "schemaId": "urn:bestpay:schema:condition-definition:1.0.0",
      "contentHash": "1fcb98f9f8b3f5b188a180941bfbb9aeb52842797e0a50473b42b1aa0d055816",
      "required": true
    },
    {
      "fileName": "reward_rules.json",
      "schemaId": "urn:bestpay:schema:reward-rule:1.0.0",
      "contentHash": "18754d253d861f8f526cfd4fcac8d1f571a733d4f130f6f9fceb3d78e37aa652",
      "required": true
    },
    {
      "fileName": "sources.json",
      "schemaId": "urn:bestpay:schema:source:1.0.0",
      "contentHash": "51f0556f6eca6e91b803a3eb8bbc167e607104e33c9dcff2c6eb41b5d2b9207f",
      "required": true
    },
    {
      "fileName": "id_migrations.json",
      "schemaId": "urn:bestpay:schema:id-migration:1.0.0",
      "contentHash": "51f3389142014edd73898e0e5e00c06288755a92d1892f47301026e945637b18",
      "required": true
    }
  ]
}
